{
  "$schema": "docs/schema/k6-receipt.schema.json",
  "schema_version": "1.0.0",
  "receipt_id": "2026-03-31-load-keycloak-105720Z",
  "scenario": "load",
  "service_id": "keycloak",
  "service_name": "Keycloak",
  "target_url": "https://sso.lv3.org/realms/lv3/.well-known/openid-configuration",
  "environment": "production",
  "runner_context": "build-server",
  "recorded_on": "2026-03-31",
  "recorded_at": "2026-03-31T10:57:20Z",
  "recorded_by": "ops",
  "source_commit": "594222cf826e093ceb3f9d1722ba38ddef3fdc07",
  "repo_version_context": "0.177.113",
  "k6_image_ref": "docker.io/grafana/k6:1.7.1@sha256:44bd1d66c2b019327991b95459d78402b0a7a0a055ab52ee088deea1a044e8d5",
  "summary_export": "receipts/k6/raw/20260331T105720Z-load-summary.json",
  "prometheus_remote_write_url": "http://10.10.10.40:9090/api/v1/write",
  "scenario_config": {
    "vus": 5,
    "duration": "30m",
    "ramp_up_duration": "1m",
    "hold_duration": "5m",
    "max_error_rate": 0.01,
    "think_time_seconds": 1.0,
    "request_timeout_seconds": 10.0,
    "latency_threshold_ms": 500.0
  },
  "metrics": {
    "request_count": 1725,
    "success_count": 1325,
    "failed_count": 400,
    "error_rate": 0.2318840579710145,
    "http_req_duration_p95_ms": 14.625955999999999,
    "http_req_duration_avg_ms": 9.325339478260867,
    "http_req_duration_max_ms": 1588.292161
  },
  "slo_assessment": {
    "availability_slo_id": "keycloak-availability",
    "latency_slo_id": "keycloak-latency",
    "latency_threshold_ms": 500.0,
    "availability_objective_percent": 99.7,
    "error_budget_consumed_pct": 100.0,
    "error_budget_remaining_pct": 0.0,
    "error_budget_warning_threshold_pct": 20.0,
    "within_error_budget": false,
    "latency_threshold_passed": true
  },
  "regression": {
    "checked": true,
    "baseline_receipt": "receipts/k6/load-keycloak-20260331T101930Z.json",
    "baseline_p95_ms": 0.0,
    "current_p95_ms": 14.625955999999999,
    "regression_ratio": null,
    "threshold_ratio": 0.2,
    "regressed": false
  },
  "notifications": {
    "nats_event_published": false,
    "ntfy_topic_notified": null
  },
  "result": "failed",
  "failure_reasons": [
    "error rate 0.2319 exceeded 0.0100",
    "ntfy notification unavailable: ntfy_alertmanager_password is not available for k6 warning notification"
  ]
}
