{
  "$schema": "docs/schema/k6-receipt.schema.json",
  "schema_version": "1.0.0",
  "receipt_id": "2026-03-31-load-openfga-133416Z",
  "scenario": "load",
  "service_id": "openfga",
  "service_name": "OpenFGA",
  "target_url": "http://10.10.10.20:8098/healthz",
  "environment": "production",
  "runner_context": "manual",
  "recorded_on": "2026-03-31",
  "recorded_at": "2026-03-31T13:34:16Z",
  "recorded_by": "live",
  "source_commit": "0d6e8c9eb5d9d086e74cf92d8165248295baa076",
  "repo_version_context": "0.177.117",
  "k6_image_ref": "docker.io/grafana/k6:1.7.1@sha256:44bd1d66c2b019327991b95459d78402b0a7a0a055ab52ee088deea1a044e8d5",
  "summary_export": "receipts/k6/raw/20260331T133416Z-load-summary.json",
  "prometheus_remote_write_url": "http://10.10.10.40:9090/api/v1/write",
  "scenario_config": {
    "vus": 4,
    "duration": "5m",
    "ramp_up_duration": "1m",
    "hold_duration": "5m",
    "max_error_rate": 0.01,
    "think_time_seconds": 1.0,
    "request_timeout_seconds": 10.0,
    "latency_threshold_ms": 500.0
  },
  "metrics": {
    "request_count": 1184,
    "success_count": 1176,
    "failed_count": 8,
    "error_rate": 0.006756756756756757,
    "http_req_duration_p95_ms": 83.68629729999999,
    "http_req_duration_avg_ms": 75.90755059628385,
    "http_req_duration_max_ms": 98.884083
  },
  "slo_assessment": {
    "availability_slo_id": "openfga-availability",
    "latency_slo_id": "openfga-latency",
    "latency_threshold_ms": 500.0,
    "availability_objective_percent": 99.5,
    "error_budget_consumed_pct": 100.0,
    "error_budget_remaining_pct": 0.0,
    "error_budget_warning_threshold_pct": 20.0,
    "within_error_budget": false,
    "latency_threshold_passed": true
  },
  "regression": {
    "checked": true,
    "baseline_receipt": "receipts/k6/load-openfga-20260331T105720Z.json",
    "baseline_p95_ms": 4.960850599999997,
    "current_p95_ms": 83.68629729999999,
    "regression_ratio": 15.869344402349073,
    "threshold_ratio": 0.2,
    "regressed": true
  },
  "notifications": {
    "nats_event_published": false,
    "ntfy_topic_notified": null
  },
  "result": "passed",
  "failure_reasons": [
    "nats regression notification unavailable: NATS endpoint unavailable at nats://127.0.0.1:4222: [Errno 61] Connection refused",
    "ntfy notification unavailable: <urlopen error timed out>"
  ]
}
